{
  "artifact_class": "exp001-r3-split-receipt",
  "status": "pre_freeze_no_targets",
  "target_values_present": false,
  "control_plan_sha256": "36305114b3d33ca1a691912b048e9f49567a1c69e7fcf08018691f0e2d293306",
  "bindings": [
    {"pair_id":"exp001-r3-pair-principle-agri","task_family":"principle","control_kind":"primary","source_family":"principles","problem_family":"modular-repair","domain_holdout":"agriculture","source_holdout":"principles","family_holdout":"modular-repair","target_locator":"sealed://exp001-r3/principle-agri","strata":["TRIZ-blinded-transfer","source-exposed-competence"],"pooling_prohibited":true},
    {"pair_id":"exp001-r3-pair-principle-medical","task_family":"principle","control_kind":"primary","source_family":"principles","problem_family":"localized-function","domain_holdout":"medical-device","source_holdout":"principles","family_holdout":"localized-function","target_locator":"sealed://exp001-r3/principle-medical","strata":["TRIZ-blinded-transfer","source-exposed-competence"],"pooling_prohibited":true},
    {"pair_id":"exp001-r3-pair-principle-lexical","task_family":"principle","control_kind":"lexical_matched","source_family":"principles","problem_family":"lexical-control","domain_holdout":"agriculture","source_holdout":"principles","family_holdout":"lexical-control","target_locator":"sealed://exp001-r3/principle-lexical","strata":["TRIZ-blinded-transfer","source-exposed-competence"],"pooling_prohibited":true},
    {"pair_id":"exp001-r3-pair-principle-neighbour","task_family":"principle","control_kind":"principle_near_neighbour","source_family":"principles","problem_family":"near-neighbour","domain_holdout":"medical-device","source_holdout":"principles","family_holdout":"near-neighbour","target_locator":"sealed://exp001-r3/principle-neighbour","strata":["TRIZ-blinded-transfer","source-exposed-competence"],"pooling_prohibited":true},
    {"pair_id":"exp001-r3-pair-matrix-forward","task_family":"matrix","control_kind":"primary","source_family":"matrix","problem_family":"mass-tradeoff","domain_holdout":"logistics","source_holdout":"matrix","family_holdout":"mass-tradeoff","target_locator":"sealed://exp001-r3/matrix-forward","strata":["TRIZ-blinded-transfer","source-exposed-competence"],"pooling_prohibited":true},
    {"pair_id":"exp001-r3-pair-matrix-reverse","task_family":"matrix","control_kind":"matrix_direction_swap","source_family":"matrix","problem_family":"direction-control","domain_holdout":"logistics","source_holdout":"matrix","family_holdout":"direction-control","target_locator":"sealed://exp001-r3/matrix-reverse","strata":["TRIZ-blinded-transfer","source-exposed-competence"],"pooling_prohibited":true},
    {"pair_id":"exp001-r3-pair-matrix-nonrecommended","task_family":"matrix","control_kind":"matrix_non_recommended_option","source_family":"matrix","problem_family":"option-control","domain_holdout":"logistics","source_holdout":"matrix","family_holdout":"option-control","target_locator":"sealed://exp001-r3/matrix-nonrecommended","strata":["TRIZ-blinded-transfer","source-exposed-competence"],"pooling_prohibited":true},
    {"pair_id":"exp001-r3-pair-tool-supported","task_family":"tool_edge","control_kind":"primary","source_family":"tool-map","problem_family":"early-framing","domain_holdout":"energy","source_holdout":"tool-map","family_holdout":"early-framing","target_locator":"sealed://exp001-r3/tool-supported","strata":["TRIZ-blinded-transfer","source-exposed-competence"],"pooling_prohibited":true},
    {"pair_id":"exp001-r3-pair-tool-unsupported","task_family":"tool_edge","control_kind":"tool_edge_unsupported","source_family":"tool-map","problem_family":"unsupported-edge","domain_holdout":"energy","source_holdout":"tool-map","family_holdout":"unsupported-edge","target_locator":"sealed://exp001-r3/tool-unsupported","strata":["TRIZ-blinded-transfer","source-exposed-competence"],"pooling_prohibited":true},
    {"pair_id":"exp001-r3-pair-abstention","task_family":"abstention","control_kind":"explicit_abstention","source_family":"tool-map","problem_family":"underdetermined","domain_holdout":"energy","source_holdout":"tool-map","family_holdout":"underdetermined","target_locator":"sealed://exp001-r3/explicit-abstention","strata":["TRIZ-blinded-transfer","source-exposed-competence"],"pooling_prohibited":true}
  ]
}
